{"$schema":"https://json-schema.org/draft/2020-12/schema","title":"DUT interface contract","type":"object","required":["schema_version","module","port_catalog","port_hierarchy","declared_unknowns"],"properties":{"schema_version":{"const":2},"module":{"type":"object","required":["name","kind"],"properties":{"name":{"type":"string","minLength":1},"kind":{"type":"string","minLength":1},"clocking_model":{"type":"string","minLength":1},"top_level_port_groups":{"type":"array","items":{"$ref":"#/$defs/id"},"uniqueItems":true}},"additionalProperties":false},"port_catalog":{"type":"object","minProperties":1,"propertyNames":{"$ref":"#/$defs/id"},"additionalProperties":{"$ref":"#/$defs/port"}},"port_hierarchy":{"type":"array","items":{"$ref":"#/$defs/portGroup"}},"declared_unknowns":{"type":"array","items":{"type":"string","minLength":1}}},"$defs":{"id":{"type":"string","pattern":"^[A-Za-z][A-Za-z0-9._-]{0,127}$"},"port":{"type":"object","required":["direction","systemc_type","width_bits","role"],"properties":{"canonical_path":{"type":"string","minLength":1},"canonical_paths":{"type":"array","minItems":1,"items":{"type":"string","minLength":1},"uniqueItems":true},"direction":{"enum":["input","output","inout"]},"systemc_type":{"type":"string","minLength":1},"width_bits":{"type":"integer","minimum":1},"role":{"type":"string","minLength":1},"edge":{"enum":["rising","falling"]},"polarity":{"enum":["active_high","active_low"]},"reset_binding":{"type":"string","minLength":1},"scope":{"type":"string","minLength":1},"drives_processes":{"type":"array","items":{"type":"string","minLength":1}},"sampling":{"type":"string","minLength":1},"asserted_meaning":{"type":"string","minLength":1},"ownership":{"type":"string","minLength":1},"valid_qualifier":{"$ref":"#/$defs/id"},"timing_contract":{"type":"string","minLength":1}},"oneOf":[{"required":["canonical_path"],"not":{"required":["canonical_paths"]}},{"required":["canonical_paths"],"not":{"required":["canonical_path"]}}],"additionalProperties":false},"portGroup":{"type":"object","required":["id","kind","members","children"],"properties":{"id":{"$ref":"#/$defs/id"},"kind":{"type":"string","minLength":1},"members":{"type":"array","minItems":1,"items":{"$ref":"#/$defs/id"},"uniqueItems":true},"children":{"type":"array","items":{"$ref":"#/$defs/id"},"uniqueItems":true},"valid_signal":{"$ref":"#/$defs/id"},"payload_signals":{"type":"array","items":{"$ref":"#/$defs/id"},"uniqueItems":true}},"additionalProperties":false}},"additionalProperties":false}
